{
  "$defs": {
    "iso_dt": {
      "pattern": "^\\d{4}-\\d{2}-\\d{2}T\\d{2}:\\d{2}:\\d{2}Z$",
      "type": "string"
    },
    "path": {
      "minLength": 1,
      "type": "string"
    },
    "run_id": {
      "pattern": "^[a-z0-9][a-z0-9\\-]{6,64}$",
      "type": "string"
    },
    "sha256": {
      "pattern": "^[a-f0-9]{64}$",
      "type": "string"
    }
  },
  "$schema": "https://json-schema.org/draft/2020-12/schema",
  "additionalProperties": false,
  "properties": {
    "created_at": {
      "$ref": "#/$defs/iso_dt"
    },
    "fingerprints": {
      "additionalProperties": false,
      "properties": {
        "config": {
          "$ref": "#/$defs/sha256"
        },
        "exports": {
          "additionalProperties": {
            "$ref": "#/$defs/sha256"
          },
          "type": "object"
        },
        "inputs": {
          "additionalProperties": {
            "$ref": "#/$defs/sha256"
          },
          "type": "object"
        },
        "root": {
          "$ref": "#/$defs/sha256"
        }
      },
      "required": [
        "config",
        "inputs",
        "exports",
        "root"
      ],
      "type": "object"
    },
    "run_id": {
      "$ref": "#/$defs/run_id"
    },
    "schema_version": {
      "enum": [
        "1.0"
      ],
      "type": "string"
    },
    "status": {
      "enum": [
        "PASS",
        "FAIL"
      ],
      "type": "string"
    }
  },
  "required": [
    "schema_version",
    "run_id",
    "created_at",
    "status",
    "fingerprints"
  ],
  "title": "Determinism report",
  "type": "object"
}
