{
  "created_at": "2014-09-16T18:38:40Z",
  "fingerprints": {
    "config": "7ce26d580cf28a95199ebdb63e73d1972a65ae6d4594f5337bd6043fbeccc431",
    "exports": {
      "exports/briefing_tables/briefing_table_entities.csv": "db0bdd6ac85f6f0ac59929e3994009b24b9df774d77eef8d03b3e221299eec97",
      "exports/narratives/deltas.md": "fb5310dedb879dd345871e433059c5fa76ea5c77bdb0ba8b2c47f68f2fc55801",
      "exports/packets/packet_E0001.json": "11181c4cc192314d7c68a3339e565f039724a9ebba9b6cc3b9b68be2b429ba25",
      "exports/packets/packet_E0002.json": "64b30c48c78d7453c1a116f061e14f2584aca0969a9738895d1ae57571a3aa2f",
      "exports/packets/packet_E0008.json": "d9689582559413b392e7f2b35cf89bb72c0190bb2e86c605567b26508f24000e",
      "exports/packets/packet_E0015.json": "43158a4300f1926a1820c5fc84a95979194b59a9bd370e6f116cf2cdc33ae1d7"
    },
    "inputs": {
      "registry": "5000cec7a57f7ea74d4e99930a2199a50f51259569433c8ba80c34560eb02a4a",
      "trade_feed": "a5bcc87b23d5d4ce218914787819f7ee2fe8d67675e4f96d3fff5d01cbc9f571"
    },
    "root": "10eb38a88a7842af372d1af6d0edffcad4ff8d3744b48c1a23aaf139afa1dbbd"
  },
  "run_id": "run-7ce26d58-0cf2",
  "schema_version": "1.0",
  "status": "PASS"
}
